<?xml version="1.0" encoding="utf-8"?>
<build-config xmlns:xsi="http://www.w3.org/2001/XMLSchema-instance"
              xsi:noNamespaceSchemaLocation="../../schemas/build-config.xsd">

    <business-module name="BusinessPFP"/>

    <web-module name="WebPFP" context-path="/PhizWebPFP" settings-path="PhizPFP">
        <business-module name="BusinessPFP"/>
    </web-module>

    <web-application name="PhizIC" context-path="/PhizIC">
        <web-module name="WebPFP" url-folder="/private/pfp"/>
    </web-application>

    <web-application name="PhizIA" context-path="/PhizIA">
        <web-module name="WebPFP" url-folder="/person/pfp"/>
        <web-module name="WebPFP" url-folder="/journal/pfp"/>
    </web-application>

</build-config>
